[
  {
    "rule_id": "med_transit_rahu_on_natal_mars",
    "name": "Rahu Transit over Natal Mars — Inflammation & Infection Activation",
    "description": "When Rahu transits over the natal Mars position, it amplifies Mars's inflammatory and surgical energy, creating a medium-term window for infections, inflammation flare-ups, and surgical necessity.",
    "source_text": {"work_name": "Brihat Parashara Hora Shastra", "chapter": "65", "verse": "10-12", "page": null, "quote": "When Rahu transits over the natal position of Mars, there will be danger from wounds, fire, and poison... inflammatory diseases and blood disorders.", "translation": null},
    "domain": "medical",
    "event_family": "surgery_and_medical_events",
    "event_subtype": ["inflammation", "infection", "surgical_trigger"],
    "rule_type": "transit",
    "status": "active",
    "priority": 90,
    "polarity": "challenging",
    "timing_band": "medium",
    "conditions": {"all_of": ["Transit Rahu passes over or within 3 degrees of the natal Mars position"], "any_of": [], "none_of": []},
    "signals": {"dasha": [], "transit": ["Rahu"], "houses": [], "planets": ["Mars"], "nakshatra": [], "d9": [], "sensitive_points": ["natal_Mars_degree"]},
    "interpretation": {"meaning": "Rahu amplifies whatever it contacts. Over natal Mars, it amplifies Mars's inflammatory, cutting, and blood-related energy. This creates a pronounced window for infections, inflammations requiring antibiotics, and conditions that may necessitate surgical drainage or intervention.", "mode": "unknown", "quality": "unknown", "confidence": 0.9},
    "window": {"broad_window_days": 90, "exact_window_days": 21, "confidence_decay_days": 14},
    "weights": {"dasha_weight": 0.0, "transit_weight": 0.9, "fast_trigger_weight": 0.0, "classical_weight": 0.0},
    "outputs": {"symbolic_label": "rahu_mars_inflammation_active", "likelihood_band": "high", "timing_band": "narrow", "recommended_action": "anti_inflammatory_protocol"},
    "metadata": {"notes": "One of the most reliable transit triggers for acute medical events. Rahu on Mars = amplified surgical energy."}
  },
  {
    "rule_id": "med_transit_saturn_on_lagna_sphuta",
    "name": "Saturn Transit on Lagna Sphuta — Systemic Bodily Weakness",
    "description": "When Saturn transits over the exact Lagna degree (Lagna Sphuta), it creates a period of systemic weakness, lowered immunity, and vulnerability to chronic health breakdown.",
    "source_text": {"work_name": "Phaladeepika", "chapter": "26", "verse": "15-17", "page": null, "quote": "Saturn transiting over the Lagna degree brings bodily suffering, weakness of constitution, and diseases of a chronic nature.", "translation": null},
    "domain": "medical",
    "event_family": "surgery_and_medical_events",
    "event_subtype": ["systemic_weakness", "immune_suppression", "chronic_onset"],
    "rule_type": "transit",
    "status": "active",
    "priority": 88,
    "polarity": "challenging",
    "timing_band": "medium",
    "conditions": {"all_of": ["Transit Saturn passes over or within 2 degrees of the natal Lagna Sphuta (Ascendant exact degree)"], "any_of": [], "none_of": []},
    "signals": {"dasha": [], "transit": ["Saturn"], "houses": ["1"], "planets": [], "nakshatra": [], "d9": [], "sensitive_points": ["Lagna_Sphuta"]},
    "interpretation": {"meaning": "Saturn on the Lagna Sphuta directly suppresses the body's vitality and immune response. The Lagna represents the physical body itself — Saturn's heavy, cold, restricting energy over this point creates systemic weakness and susceptibility to chronic conditions.", "mode": "unknown", "quality": "unknown", "confidence": 0.88},
    "window": {"broad_window_days": 120, "exact_window_days": 30, "confidence_decay_days": 21},
    "weights": {"dasha_weight": 0.0, "transit_weight": 0.88, "fast_trigger_weight": 0.0, "classical_weight": 0.0},
    "outputs": {"symbolic_label": "saturn_lagna_systemic_weakness", "likelihood_band": "high", "timing_band": "narrow", "recommended_action": "strengthen_immunity_and_rest"},
    "metadata": {"notes": "Lagna Sphuta is the most sensitive health point. Saturn's transit here is a reliable indicator of health vulnerability windows."}
  },
  {
    "rule_id": "med_transit_lagna_lord_in_dusthana",
    "name": "Lagna Lord Transiting 6/8/12 — Self in Disease/Surgery/Hospital",
    "description": "When the lord of the Lagna transits through the 6th (disease), 8th (surgery), or 12th (hospitalization) house, the native's vitality is placed in houses of suffering.",
    "source_text": {"work_name": "Jataka Parijata", "chapter": "14", "verse": "5-8", "page": null, "quote": "When the lord of the Ascendant transits through the 6th, 8th, or 12th houses, the native suffers from diseases, undergoes surgical procedures, or is confined to bed.", "translation": null},
    "domain": "medical",
    "event_family": "surgery_and_medical_events",
    "event_subtype": ["disease_activation", "surgery_window", "hospitalization"],
    "rule_type": "transit",
    "status": "active",
    "priority": 85,
    "polarity": "challenging",
    "timing_band": "medium",
    "conditions": {"all_of": [], "any_of": ["The natal Lagna lord transits through the 6th house", "The natal Lagna lord transits through the 8th house", "The natal Lagna lord transits through the 12th house"], "none_of": []},
    "signals": {"dasha": [], "transit": ["Lagna_lord"], "houses": ["6", "8", "12"], "planets": [], "nakshatra": [], "d9": [], "sensitive_points": []},
    "interpretation": {"meaning": "The Lagna lord represents the self and physical vitality. When it transits through Dusthana houses (6/8/12), the native's life-force is temporarily placed in houses of disease, surgery, and confinement — activating medical vulnerability.", "mode": "unknown", "quality": "unknown", "confidence": 0.85},
    "window": {"broad_window_days": 60, "exact_window_days": 14, "confidence_decay_days": 10},
    "weights": {"dasha_weight": 0.0, "transit_weight": 0.85, "fast_trigger_weight": 0.0, "classical_weight": 0.0},
    "outputs": {"symbolic_label": "lagna_lord_dusthana_vulnerability", "likelihood_band": "moderate", "timing_band": "narrow", "recommended_action": "avoid_risky_activities"},
    "metadata": {"notes": "Differentiates by house: 6th = disease onset, 8th = surgical intervention, 12th = hospitalization/confinement."}
  },
  {
    "rule_id": "med_transit_mars_over_8th_house",
    "name": "Mars Transit over 8th House — Surgical Window Activation",
    "description": "Mars transiting through the natal 8th house activates the house of surgery and creates a medium-term window where surgical interventions are most likely to occur.",
    "source_text": {"work_name": "Brihat Jataka", "chapter": "25", "verse": "3-5", "page": null, "quote": "Mars transiting the 8th house brings danger of wounds from weapons, surgical operations, and blood loss.", "translation": null},
    "domain": "medical",
    "event_family": "surgery_and_medical_events",
    "event_subtype": ["surgery_window", "wound", "blood_loss"],
    "rule_type": "transit",
    "status": "active",
    "priority": 82,
    "polarity": "challenging",
    "timing_band": "medium",
    "conditions": {"all_of": ["Transit Mars passes through the natal 8th house"], "any_of": [], "none_of": []},
    "signals": {"dasha": [], "transit": ["Mars"], "houses": ["8"], "planets": [], "nakshatra": [], "d9": [], "sensitive_points": []},
    "interpretation": {"meaning": "Mars (planet of surgery, cuts, and blood) transiting the 8th house (house of surgery, transformation, and crisis) creates the most direct transit indicator for surgical intervention. The natural karaka activates its natural house.", "mode": "surgery", "quality": "unknown", "confidence": 0.82},
    "window": {"broad_window_days": 45, "exact_window_days": 14, "confidence_decay_days": 7},
    "weights": {"dasha_weight": 0.0, "transit_weight": 0.82, "fast_trigger_weight": 0.0, "classical_weight": 0.0},
    "outputs": {"symbolic_label": "mars_8th_house_surgical_window", "likelihood_band": "moderate", "timing_band": "narrow", "recommended_action": "postpone_elective_surgery"},
    "metadata": {"notes": "Mars spends approximately 45 days in each sign. Its 8th house transit creates a predictable surgical vulnerability window."}
  },
  {
    "rule_id": "med_transit_saturn_mars_mutual_aspect",
    "name": "Saturn-Mars Mutual Aspect in Transit — Chronic Inflammation Flare",
    "description": "When Saturn and Mars form a mutual aspect in transit (opposition or square), it activates chronic inflammatory conditions and creates a window for disease aggravation.",
    "source_text": {"work_name": "Phaladeepika", "chapter": "26", "verse": "20-22", "page": null, "quote": "When Saturn and Mars aspect each other in transit, there will be diseases of an inflammatory yet chronic nature, affecting bones and blood simultaneously.", "translation": null},
    "domain": "medical",
    "event_family": "surgery_and_medical_events",
    "event_subtype": ["chronic_inflammation", "autoimmune_flare", "disease_aggravation"],
    "rule_type": "transit",
    "status": "active",
    "priority": 78,
    "polarity": "challenging",
    "timing_band": "medium",
    "conditions": {"all_of": ["Transit Saturn and transit Mars form a mutual aspect (7th aspect opposition, or Saturn's 3rd/10th aspect on Mars, or Mars's 4th/8th aspect on Saturn)"], "any_of": [], "none_of": []},
    "signals": {"dasha": [], "transit": ["Saturn", "Mars"], "houses": [], "planets": ["Saturn", "Mars"], "nakshatra": [], "d9": [], "sensitive_points": []},
    "interpretation": {"meaning": "Saturn (chronic, cold, restrictive) and Mars (inflammatory, hot, acute) in mutual aspect create a paradoxical combination of chronic inflammation — conditions that are both persistent AND painful. This triggers autoimmune flares, bone infections, and chronic pain syndromes.", "mode": "chronic_disease", "quality": "unknown", "confidence": 0.78},